How to build a oven312,"Measure out the baking soda and baking powder and add that to the grated butter in your mixer or food processor. Add about 2 tablespoons (15 g) butter, and pulse the mixture a few times. Finally, add the egg, salt, and pepper to the bowl. Continue whisking the mixture until everything is incorporated.
If you don't have a food processor, you can also use a blender instead.
The mixer or food processor usually will take your ingredients into account. Once you get your ingredients to mixed, you can add the chopped dill and turn the mixer on low speed. You'll start to see the pineapple, rosemary, and thyme slowly begin to bubble. When you're done whisking it down a bit, it should feel like the pineapple slices were added together.
Make sure to wait for the pineapple slices to cool before you add them to the baking soda.
The finished product should be a thick, even consistency.
You can use an immersion blender if you don't have a food processor. Keep an eye on the ingredients at all times as you make your baking soda mixture. Once the mixture is incorporated, it should look like a thin, smooth batter.
The batter should look something like a toothpick, but if it's too thick, you can add a little more batter.
The batter should look as thin as possible and not as thick.",2022-04-05 14:15:09.805484
How to build a furnace300,"Place the flammable materials you can find at your local hardware store, then cut them out using a utility knife. This will create the necessary furnace parts. The flammable materials you can find at your local hardware store, then cut them out using a utility knife. This will create the necessary furnace parts.

You can find steel wool or aluminum foil as well as lightweight flammable materials like aluminum foil. These items are sometimes referred to as ""faux"" materials for this purpose.
If you live in the US, you can get these types of materials in your local hardware store, or online.
Once you've assembled your furnace, make sure that it has a running fan to reduce air pressure and heat.
Once the furnace is installed and running, you should be able to enjoy your homemade furnace. You can purchase equipment like this at most national retailers, such as Home Depot.
Place your steel wool or aluminum foil into the open area of the furnace. Carefully line up the edges of the steel wool with the openings in the aluminum foil. You can check the size and height of the steel wool by carefully checking the opening for the steel wool. Measure the steel wool by using the square footage of the furnace and compare that to the measurements of the foil.

For example, you could use 1 pound (15.",2022-04-05 14:16:18.943639
How to make bread300,"Combine butter, olive oil, sugar, and salt. Use a butter knife to cut through the butter, then spoon in the flour and baking powder.

To make puffy puffy bread, slice the dough according to package directions, or use a sharp knife to cut it in half.

You can use a large mixing bowl or a smaller measuring cup instead. You can also use a stand mixer to beat the dough over low heat, stirring occasionally to mix in the dough.

If you are mixing a larger mixing bowl, add a third of the flour in each half.

The puffy bread needs to be very moist before you can add flour. You can use the palm of your hand to smooth the dough.
To get the consistency you want, add 1-2 teaspoons of butter, 1 cup of olive oil, 1 1/2 teaspoons of flour, 1 3/4 teaspoons of salt, 1 tablespoon of sour cream, 1/4 cup of sugar, and 1 tablespoon of baking powder.

Use a mixer on high speed if you can and make more than 1 dough ball when you are ready to add the puffy bread.
If you cannot find dry puffy bread at the grocery store, consider pre-filling it with fresh bread dough before you start your puffy project.
You can also find puffy puffy pails online.",2022-04-05 14:16:54.119833
make bread,"Do this to help ensure you're cooking evenly.  You can also use rice flour in place of flour if you'd like.
You can use any type of flour, but be careful when measuring or mixing it.  Too much flour can cause the dough to harden.  Avoid using too much flour as it can cause the dough to stick together.
The recipe you use to make this recipe will vary depending on the type of flour you use.
You should use plain white flour and a little rye flour.  In general, though, use rye flour and a little wheat flour to create a pale dough.
This bread is going to be a little harder to pull apart when it’s done.  Your finger should be able to peel away the flour.  You can pull the bread out of the way just by pressing hard enough.  The longer the bread is in a pan, the harder it will become to pull apart.  Keep pulling hard so that the inside of the loaf will stay even.  It will need to be quite thick, however, for this project.
Remove the pan from heat.  You can either do this from a wire rack or a plate with a lid.  You'll need to place the pan in a cool, dry place.
To  out of thin strands, you'll need some twine.",2022-04-05 15:36:06.426881
How to 312,"Get Your Hair Done at Home
 Before you iron and iron your hair, wash it in a sink basin. Rinse and dry it before using it on the next step.
After washing your hair in a sink basin and before you iron it, dry it in a clean, dryer shower.
Apply the dry shampoo and conditioner to the tips of your hair and let the shampoo sit for 5 to 6 minutes before you iron it again.
Be sure not to rub and wring the shampoo. Make sure to do this about every three hours.
If your hair tends to become dry and frizzy after using your dry shampoo and conditioner, it’s time to dry it.
After you dry your hair, make sure that the conditioner is in a spray bottle instead of using it to apply the conditioner.
Once you have your hair covered with conditioner, use a bobby pin to hold it up while you iron. Pulling it up will prevent your hair from getting very dirty. This may take some time.
If you don’t want to tie the bobby pin to a bun, tie a rubber band around the bobby pin to prevent it from becoming tangled. To secure the bobby pin, flip the bobby pin over, and secure it with the bun on top.",2022-04-05 15:44:17.225053
How to 300,"Light a match for your clothing!
 If you're working with a kid, look out for adult matches.
Look around your home if it has clothing displaying a pattern.
If you don't see the pattern, call the store and ask to borrow it.
If you're in a rush, consider signing up for a custom match.
If you see the pattern on your dress, grab a copy and write down the date and time and have it ready for you later.
To ensure that you have time to read and remember the pattern quickly, read the label.
It may say something like ""final draft"" or something like that.
Pick a spot in the middle of the room and place your hands on either the dress or the matches. Make sure that you're keeping your hands at a comfortable level.

Don't push them too far back or you may end up causing discomfort.
Keep your arms at shoulder height and hold them there. Hold a short ""C"" in the middle of your thumbs. Keep a long ""L"" between your hands for extra support.
If you're using a knit fabric, place the same thread in one hand as the knit fibers on the other hand.
You can also use any type of stretch fabric.
Do this to support your hands if you use a heavier fabric.",2022-04-05 15:46:05.013153
How to 300,"The best place to store your batteries is on your wall or basement. The battery pack is the space underneath the electrical panel. If a wall is in a metal or plastic bag, slide the battery compartment off so that there are no open spaces on it. If the pack is fully empty, it will only last a minute or two.
If there are any gaps or breaks that must be repaired, you’ll need to remove the battery pack and replace it. You can’t replace a non-removable battery pack if there’s a gap in it.
The easiest way to access the battery compartment is to hold the battery in your hand and pull out the loose end. Make sure that you use your elbow to pull the end open, and that your fingers are facing you. If this doesn’t happen, simply slide your hand out so that the loose end is inside the pack and into your palm. You can do this with your wrist to lock into place with the hand holding the battery.
Using an outlet, plug the cell in as tightly as you can so that you don’t accidentally break the battery pack.
You can do this by opening your phone's charging cable to the right side and putting the charging cable into the phone case.",2022-04-05 15:47:47.704487
make bread,"Place the bread at the top and under the heat source until it's melted.

Don't let it cool beyond the point of about five minutes.
Leave the bread out on a paper towel or in the fridge overnight.
The process is basically the same as making crackers or crackling bacon (which is basically the same as making regular, crackling bacon), except that when you reach that point you'll have to heat up a little bit more.
If you've got some left over, you'll know you have a tasty bite.
If you do end up needing more time, the fat in the bread won't go down and it'll become more crisp and foamy after you've eaten.
Place the sliced bacon on a cutting board and place the chopped bacon on a cutting board again.
Put the cutlet into a greased loaf pan with the cutlets on top of it.
This method will let the slices cook longer, which may seem like overkill, but keep in mind that slices will be very thick on their own. It also preserves your crispy crust and will make it easier for your slices to stick together over time.
The bacon may end up sticking out a little longer in these loaves than in regular breads.
Don't worry -- the bread is crispy and will absorb some of the extra moisture in the bread.",2022-04-05 17:45:22.920351
How to boil an egg158,"Use a handheld handheld to collect the egg yolk and whisk it until it is thoroughly blended into the yolk. Whisk until the egg yolk is thoroughly blended and smooth.
Remove the skin, oil, and yeast from the egg whites. Add 1 cup (180 ml) of warm water and stir until the egg yolk is well blended in with the yolk and whites.
Mix together the sugar, salt, and baking soda in a small saucepan or saucepan until the mixture is extremely light. When the mixture is thick, add the eggs. Continue to stir continuously while turning the stove on high heat until the eggs become light brown. When they are pale in color, remove them from the heat.
Stir them until they are completely combined. Do not allow them to cook during this step.
Remove the strainer that contains the egg white.
Put the strainer back on the stove and turn the heat to high. Heat the egg white in a microwave-safe (safe for children) bowl until it reaches about 110 °F (49 °C). Remove it from the heat. Then, transfer it to a warm plate and let it cool.
The strainer will be thick enough to hold your egg whites while they cook, but thick enough to be able to handle in the dish.
When done, the whites should have a white, opaque lather.",2022-04-05 17:53:35.352292
How to boil an egg75,"If you are concerned that your egg will become hot as it is being cooked, don’t let it sit on the burner. Place a metal spoon under the stove for about a minute. Let it simmer for approximately 10-15 seconds, then remove it from heat.

You may also want to test the egg before preparing it if your egg is too cool to cook. If the egg has just begun to brown, it is probably hot enough to overcook the egg.
Once the egg has cooled enough, pour the warm water, sugar, and garlic along with the water. Stir the ingredients until they combine. When you are ready to serve, stir the egg white into the egg mixture.

If your egg whites are not already foamy, add about 1 cup (118 ml) of white vinegar for every 1 cup (165 ml) of vinegar.
Once the egg has been heated, pour the egg white mixture into a microwave-safe dish in the microwave. The microwave should let the egg white and white mixture combine completely.
Pour the egg mixture into the prepared dish, microwave-safe dish, and the microwave-safe dish. Wait 30 minutes for the egg mixture to cool. Stir each egg individually within 1 minute, then pour the egg mixture into the prepared dish.",2022-04-05 17:59:32.119843
How to Become rich156,"Invest in your education, skills, and potential professionally so that you’ll get a good deal of financial support. Develop a high-quality career and earn a steady income by working in a team to support yourself and your family. Try starting a business, starting a team, or purchasing a home. Choose the path that gets you the most recognition, then build your resume and skills base over time.

If you don’t have a professional degree, choose from a pool, which can provide you with a pathway that fits you well. You can also pursue your own personal interests, such as becoming an independent contractor or working as an electrician in your spare time.

If you find your path too limiting, you may want to move to a more secular career field or pursue a more niche career outside of the classroom.
Choose a path that appeals to you, rather than disadvantages. If you don’t like school, for example, enroll in a program like Grayscale, an online education company that focuses on analyzing and teaching video games to high school students.
You can also pursue a professional degree, but you’ll need to invest in it first to earn it. To find a path that appeals to you, attend a class that teaches advanced or technical subjects like chemistry, physics, statistics, and chemistry, such as a masters in either discipline.",2022-04-05 17:59:36.031157
How to train a model300,"You will have to learn how to use the ""Smart Car"" feature for navigation and the navigation map. Once you learn to use the feature, you should be on board with navigation.

You should never drive on a deserted road. This can damage your car. If you must, stop before driving at night.
In the event that you do go into and out of the car, take full advantage of your available fuel. Be sure to have all of your batteries off before you begin your training.
In the event that you are traveling alone, make sure that you have enough fuel. This will help prepare you for the race.
Remember that your car should be safe and equipped with navigation controls. If you are on the phone with your phone (iPhone, iPad, etc), take your phone with you if you cannot get into your car comfortably.
In the event that you must change your car's navigation settings, take your iPhone's navigation settings. Once again, replace the batteries. This will save you lots of frustration.
The car should be as stable as possible. When one of the controls does come back on, check the status of the car and keep driving.
You can turn off the camera during practice and test the handling.
As an instructor, you should make sure the instructor is aware of all the requirements of each car.",2022-04-05 18:00:54.962961
How to Post on linkedin300,"This is how all web pages, including blog posts, respond to links. There are lots of ways to get started on creating an effective blog post—simply copy and paste the content of the blog post onto a link or your own site's HTML.

You can tag your blog in multiple different ways, from a simple post to a paid slideshow video with a tag like  embed:

""Linkedin30 blog post.""
""Linkedin300 blog post.""
You can also tag your own blog in your own unique way using a tag like  embed:

""Linkedin300 blog post.""
You can also tag your own blog using a tag like  embed:

""Linkedin300 blog post.""
You can also tag your own blog using a tag like  embed:

""Linkedin300 blog post.""
You can also tag your own blog using a tag like embed:

""Linkedin300 blog post.""
If you want to make it easy for others to read your blog, write in the footer the links you have selected. If you want to embed a link directly in the post, do so in the first post you create.
The key components of your site's tagline are the body tag and the footer.",2022-04-05 18:02:57.590922
How to start a business300,"Start by buying a business online and doing research online. Search for a local area that has a specific brand name or logo to work with.

Write down the location in your company or on the company website, and get a business logo or name.

Look up local stores that sell products and services online.
Write down all of the current owners.

Identify owners by searching on a business’s website, on social media sites, or in advertising.
Analyze the brand name on a variety of websites and media outlets. Use the results to help you figure out which store to target.
You can use this method to get creative in researching potential customers.
Search for a community of passionate business owners online and ask for recommendations.
Ask employees how they’ve changed over time and brands.
Look up the owners' social media accounts.
Find out if they are open to new ideas for their store.
If they advertise for a specific brand, ask their employees what their favorite products are currently offered.
Find out if their employees are active in their communities.
Search for their contact information.
Search for their current location on social media.
Once you’ve found the owner, contact them and let them know about their business.
Start by searching for their current location on social media.",2022-04-05 18:03:12.503133
How to do mobile tracking300,"Start by checking the color of the map on your phone. This will show up as a red, green, blue, and yellow.

If this color is not picked, tap the photo that you want to track. Select ""Done"" to launch a pop-up menu. Select a picture of your car (if desired) and tap the picture to start uploading the image to your computer.
If your phone doesn't already have a location system, you can download it here.
Tap  at the top right corner of your screen. Tap the photo that you want to record.
If you're planning on putting your car in the trunk, check to make sure that the location that you select in the pop-up is accurate (like a yellow ring around the trunk lid). You will also need to select an exact time when you will be driving.
The photo you want to record will be different for each car you plan on putting in the trunk. If the time is already listed, you will still have time to track down the vehicle in the trunk.
For example, if the time is listed as 3:00 pm, you'll also need to select 3:00 pm on the map.
Once you have a record of time in the trunk of your car, you can save it online and send it to your phone. This uploads the time to your smartphone.",2022-04-05 18:03:51.476189
How to do makeup312,"This is a pretty simple primer that doesn't contain much, so it's pretty easy to work with or apply later. You could use the same primer you just used on your eyes, or you could use different colors.

You can either use powder or concealer in the primer or you can use either the bronzer or the eyebrow powder instead.  If you only need two pieces, use an 8"" by 11"" (46 by 51 cm) size.

If you're using the lighter color, use about 3/4 of your face area.
If you’re using a matte makeup, you could use 1/4 of your face area.
If you’re a darker color, just blend it with lighter eyeshadow or eyebrow powder.
Makeup primer contains all the essential oil and lip balm, so that's a good option if you’ve oily skin, oily eyes, or a light complexion.  For darker tones, try olive, apple, or grapeseed oil.  Try out both oils.
Try blending the primer between your eyebrows and your nose, or between your cheeks and your nose as well, depending on your skin condition.
The bronzer is what you usually use on your eyebrows.  It can also be used on your eyes if you have light, oily skin, or acne.",2022-04-05 18:04:25.443812
How to do makeup?312,"If you're wearing makeup for work, you should always have a makeup pencil handy on hand to help you get started. Try this first to find the right color for your face and make sure you're getting enough coverage. If you're only going to be applying foundation, then you might want to be doing concealer.
For example, if you're making a foundation brush, then it's still important to get enough coverage. The brush's also a good way to keep the makeup primer to a minimum and make the parts easier to apply later.
Since you'll need to use the brush for this section, there are many different brushes available. The easiest way to use one is to use a makeup sponge. If you can, though, use a different brush for this section.
For example, if you're making a foundation brush, you can either use a brush that comes with a concealer brush or use a brush with a brush with a matte brush.
If you use a brush for this part of the application, you'll need the concealer, so make sure the brush is one that will make your face look good.
For the face, you want the brush to be very flat. If you want something that's a little bit more volume, add in a brush for your lips. If the brush has a wider end, you can use a brush for that part of the application.",2022-04-05 18:04:52.101163
How to do makeup?312,"When it comes to makeup and concealer, you shouldn’t get as much out of your makeup as you would for a regular regular makeup application. In addition, some people have higher eyelid counts than other people, so you may want to choose concealer that’s not as thick or thin. There are a few different types of concealer that have different pigments, so you may want to look for a lighter color if you’re going to use a creamier color to create eyeshadow. Try a lighter colored version if you’d prefer a darker shade.
To determine the makeup product that you’ll need, use the scale on the upper right or lower left side of the product. You might want to look for a powder or a powder with a powder-like consistency.
Make sure your scale’s listed on the right side of the product’s page. You'll be using the scale on the left side to find out what kind of makeup you need and a few other tips to help you choose the right one for your makeup look.
Once you’ve determined your makeup makeup makeup, you can make sure it matches your face with your natural hair, making the process easier by taking it apart to determine the makeup you’re working with.",2022-04-05 18:04:52.245793
How to do makeup?312,"In a circular motion, use a large spray bottle or a sponge to spread the makeup onto your face. Brush the bottom layer of your makeup onto your forehead, to make it easier to remove and apply.

This will help it stick better to the natural color of your face.
Make sure you use the right amount of powder, so that the powder doesn’t get all of the way onto your face.
Use your fingers to gently smooth down your makeup. This helps the makeup stick on your forehead and forehead areas.
Apply the remaining powder evenly and remove it from your forehead. Use your fingers to smooth your makeup into a small layer.
Avoid using cream or eye powder, since they will have a lot of built up products.
You can add essential oil, concealer, concealer concealer pigments, concealer cream, etc. to the powder if it is too thick or if it has not already been applied. Use an essential oil that is similar to the one you used.
The heavier your makeup, the more it will be easier to remove and apply. Once you’re finished applying the essential oil, place your makeup on a surface that isn’t too slick.
This will help hold the powder together.
Take a small, sharp object, such as a pencil or paper, and dip the pencil in the oil. Press down lightly.",2022-04-05 18:04:52.570412
How to do makeup?312,"There are tons of makeup online that are free and affordable.  Before starting any makeup, choose the makeup product you have researched, then research what it does, and look for products that specifically target your specific color, size, or makeup style. If your product has specific eye-catching designs, then you may not have to pick up an entire range.
If there are a lot of colors and shadows in a product you want, look for makeup that has those shadows. Try to find the shade by hand rather than trying to find a stand-alone color.
Look for color pallets, eye shadow molds, or even an eyeliner brush that will blend well.  Eye shadow molds are easy to find, but you'll have to go back to makeup store to get one.  Some also have stand-alone eyeliner brushes to use.
If there is only one essential oil or mineral oil you can purchase in a makeup routine, it is difficult to find makeup that will blend with that essential oil or mineral oil.  If you look online for regular makeup, such as eyebrow oil or foundation, it is often easier to find them online.

Even if you purchase natural oils and don't need them to try this makeup, there are some oil and mineral oil options that are good options for beginners.  For example, try  eyebrow powder instead of the regular eye shadow.",2022-04-05 18:04:54.615914
