make bread,"Pour 1 cup (240 mL) of active dry yeast into a small bowl and stir the ingredients together. Do not add water to the bowl until the dough has doubled in size and the yeast has dissolved into the water. Once the dough has doubled in size, mix in the water and sugar.
While yeast may start to bubble and get cloudy, this process does not take place as quickly. After the yeast has dissolved in the water, stop mixing so that the dough does not over-fill.
Once the yeast mixture is mixed with the flour, allow the dough to rest on its side for 30-45 minutes. This time, turn the dough over so that the dough forms a ball. While the dough is resting in the middle of the ball, the steam from the steam will create a rough, bubbly dough. Allow the dough to rest for 30 minutes.
Avoid storing bread in a warm, dry place and never reheating it again. If your bread is stored in a warm, dry place, you will not need as much of the yeast as you would for an ordinary treat.
The dough can rest for up to an hour in a warm, warm, or hot place to improve its texture. The time the dough rest period is up to the individual recipe.
For a classic treat, make your bread slice a little shorter or longer than the rest of the dough.",2022-04-04 13:58:47.786118
How to dance312,"Stand up straight and your feet together (not rigidly). Take a deep breath and let out a big breath. Then, lift your arms up into a prayer posture. Your right arm should be raised above your head with your left hand slightly cupped.
Try to keep your back straight as well. You should be able to straighten your back and out of position if you keep your back straight.
Once you have relaxed and relaxed your spine, lift your head to your chest to complete the circle. Hold this for 5 to 10 breaths and then return to the starting position (forward, neutral).
You can continue to alternate with either a straight back or a headstand.
While you’re at it, pay attention to your breath level. It may be helpful to take some deep breaths to get your abdomen in check and to keep it engaged. For instance, if you notice your chest puffing up, hold this for 5 breaths and then gently lower your body back down, so that your abdomen has relaxed a little.
Try not to make your breath shallow or sharp, as you should feel your breath level.
While standing up straight, look up and find that it’s in a circle. Make an ""L"" shape shape on the side of your head on either side of your head with your right arm positioned directly in front of you.",2022-04-04 13:59:03.224480
make bread,"If you are having trouble making bread for breakfast or lunch, then you will need to make a few ingredients beforehand.  For example, you could make 1 pound (453 g) of butter.  Or, you could make 1 pound (453 g) of butter and 2 tablespoons (17 ml) of milk.  So, you might start with 1 tablespoon (17 ml) milk instead of 3.
For each of these two types of ingredients, you can use 1 tablespoon (5.5 ml) butter and 2 tablespoons (17 ml) milk.
If you have a large enough breakfast or lunch, then you could use 1 lb (155 kg) of butter.  If you use a smaller loaf of bread you will end up with a larger loaf.  You can also use 2 tablespoons (10 ml) milk for 2 large loaves of bread.
In a double boiler, take 2 cups (450 ml) of water.  Fill the bowl you just made with 1/3 cup (120 g) of water and add 1 cup (30 g) of flour.  Use your hands or a spoon to stir the mixture gently and let the mixture rest.
Add 1/3 cup (120 g) water and 1 cup (30 g) of flour and stir the dough so that it has a smooth and elastic consistency.",2022-04-04 13:59:48.956440
How to dance ballet300,"This skill is only available to dancers with advanced dance knowledge. Read the choreography section for more information, and also find out the choreography standards.
The dance moves require a good concentration, both for the dancer and for the music. If your dance teacher recommends moving your head around a bit, it will help in making sure your eyes are closed before moving away from the music and into the dance.
You may think it looks awkward to sit with your feet in front of you or sit in a chair; that is not the correct way to sit.
If you need to move your knees, reach for them to brace yourself against a wall or your hands.
If you need to dance in a more relaxed mood, like with dancing at home or in front of the fireplace, you might move your knees to one side or the other.
Stand straight in a comfortable position so that your knees are at shoulder-width apart and your feet are at ankle-width apart.

Move your hips back and forth across your body so your heels are perpendicular to the floor.
Hold the pose for 10 to 20 seconds. Hold for 10 to 20 seconds at a time before switching directions.

Try to perform the pose as soon as you are comfortable with moving your hips back and forth.
One of the most important elements of dance breathing is maintaining your posture.",2022-04-04 13:59:50.165827
How to dance ballet300,"dancer's block
 The blocks are the walls surrounding the dancers. You will need to position each corner in a specific order and ensure that the wall you place it in actually blocks the corners.

The dancer can move around the blocks on his or her own while still keeping a distance from the dancers. It is possible to move the blocks off of one another during the dance in a circle or square, which is very useful when trying to synchronize movements between your blocks.
In order to make the dance more choreographed, one of the easiest ways to do it is to place the dancers face-down on the floor with the balls of their feet flat against the floor behind them. When you’re done, you can take a left and move on to a right, the other way around. However, you can always switch to a left and move onto a right.

As you move down, your hands will point up from behind your feet. The hands that are pointing will be more likely to move your whole body than the ones that are pointing at your feet.
Once you’ve had your blocks positioned and are ready to move on to a side, your hands should hang loose from behind your feet. The best way to do this is to move them on their own with your knees pressed to the floor at shoulder height and grab them with your right hand.",2022-04-04 14:03:53.674216
How to make sugar312,"Sugar is made in four basic ways: using warm water, in which you pour it down the sink basin, in which you place the container, and in which you let it steep in the fridge and freezer for two to three months. When you are ready to make the necessary adjustments, add water and sugar.

Use warm water. This will remove excess water from the container. You will pour it down the sink, but it won’t be as compact and hard to squeeze down. You can also pour it down a long spout instead.

In the refrigerator, place the container on a cutting board and cut the sugar in half lengthwise. Next, make a small indentation with the sugar ring. Line up all the sides of the indentations with the narrow side of the indentations (about 2 inches wide apart), then fill each of them with water, stirring frequently until you reach about 0.5 inches (1.3 cm) in height.

The sugar can be broken up into smaller pieces, or mixed into the container in smaller amounts as needed.

Make sure to use large clumps instead of slabs since the sugar can stick to the broken pieces if you let it sit for more than a week.
If you are using a blender, use a blade that can stretch your hand very well.",2022-04-04 14:57:30.490962
make bread,"Use your hands or your fingers to lift the crusty surface of the crust. Take a sharp knife and slice off several small pieces.

For slices of crusty bread, such as a brioche bread, you'll need 1½ inches (2.54 cm) of extra crusty bread slices to hold the bread together.
Try using sharp serrated knife cutters for best results.
Slice the crusty surface with your fingers. Don't be afraid to use a fork to slice the bread crusty surface. The bread needs room to rise, so be patient.
You can work on one side or the other while you work, depending on which you're working with. It's up to you to decide what you want to do with the bread, so be patient.
If you don't have the time to make the bread yourself, you can slice the crusty bread into bite-size pieces.
Lay the bread flat on a cutting board. Cut the crusty bread onto a clean cutting board. Leave a ⁄4 inch (1.3 cm) slice inside so it rests evenly. You can place the slices in your freezer bag to air-dry.

Do your best not to cut the crusty bread too large. Cutting too much bread could lead to the crust cracking.
Leave a ⁄4 inch (1.",2022-04-04 15:02:02.173570
make bread,"by adding boiling water to a microwave-safe bowl.  Mix in ¼ cup (118 ml) plus 2 teaspoons (9 g) of kosher salt, ¼ teaspoon of baking soda and ½ teaspoon of ground cinnamon.
The bread will absorb the salt.  Mix the ingredients until the salt is dissolved.
Cover the bowl with plastic wrap and refrigerate until the bowl is cool to the touch.  Store the bread on a cutting board, as a cool-to-the touch.
If the bread is toasted over, it will toast to the touch.
Toasting bread at room temperature isn’t as great as reheating bread at room temperature.  Heat and dry the bread in the microwave on medium to high heat in the microwave or a low heat setting.  Once the bread has been toast, it will cool.  Test the bread for several minutes to determine the temperature and the final texture of the bread.  If the bread gets too hot to consume all of the ingredients, leave it cool to the touch.
If the bread is toasted over too long, you'll end up with chewy, soggy slices.
In a bowl, combine 3 cups (414 g) of flour, 1 tablespoon (29 g) of salt and 1 tablespoon (14 g) of brown sugar.  Whisk the ingredients until well combined.",2022-04-04 15:02:11.120014
make bread,"There are 4 main types of bread bread: flat, box, egg, and rye. Flat bread is also called ""thin,"" since it has several layers. You could also make this bread by cutting each slice into equal slices.
When making bread with thin slices, it’s important to cut each slice into equal pieces.
Place the slices in a breadbox or Tupperware dish with a lid. Then, microwave for 1 minute to 2 minutes. Stir the ingredients until they’re evenly combined. This will help evenly distribute the fats and oils in the bread.

When the fat or oil has melted and you want to cut each slice into equal pieces, take a second breadbox and set it out to air-dry.
When the bread is finished steaming, let it cool completely. Once it’s cool, you can place it back into the refrigerator or freezer if you can’t find it in the pantry.
You can cut these bread slices into even pieces by placing them in the oven. If you don’t have a breadbox, you can use another breadbox or Tupperware dish.
Once you’ve made enough bread, pour flour into a mixing bowl and add baking soda to it. Keep stirring until the flour is combined with the dough and the dough is smooth and elastic.",2022-04-04 15:03:37.713177
How to drink tea326,"This is a simple but effective way to bring in a tea and drink it without the usual worries. There are a few different tea blends of tea that combine different tea types.

The main tea blends that come out of the various types of tea are  a tea called a tea con tea and a tea called a tea con tea. This type of tea mixes regular, blended ingredients. Mix them together and then enjoy your delicious tea with the twist of your hand. It tastes just the same.
Some tea blends have a higher proportion of tea extract than others.
Some tea blends have a higher ratio of tea, so that the tea is sweeter than other tea blends. For this reason, it is common to drink a higher amount of tea and tea con than straight tea.
Whichever tea you prefer, you should aim for a cup that's ⁄4 cup (0.5 US L) thick. Tea is soft and rich, so you should aim for something between ⁄4 cup (0.5 US L) and 2 ⁄2 cups (180 mL) thick.
Some blends of tea come with a different brewing method, called a tea press. If you don't have a press, you can find it online or at a tea shop.",2022-04-04 15:03:48.224511
How to drink tea326,"Mix one tablespoon (29.28 g) of water and 1 cup (240 mL) of sugar in a mug.  Take a mugful and pour it into your coffee mug.  You don’t need to know how to do this, just choose enough room temperature water and it’ll take about three minutes for the sugar to dissolve and form into liquid.  You can use this method if you prefer.
You can pour enough water into your mug to fill two glasses of coffee if you prefer.
Once you’ve added more sugar, pour out the liquid.  Wait for your tea to cool down and then pour the mixture into a mug.  If it’s still a bit thick, pour more water.

If you don’t have enough coffee to fill your mug, you could also add more sugar.
After mixing the solution to your mug, stir it in carefully to form a dough ball.  Depending on the size of your mug, your dough might be twice as large or even more.  This will make it easier to mix and to get the right amount of foam.
Make sure to fold in your dough ball as much as possible.  If it’s not even a full ball, the foam could form and you may end up with a little mess.",2022-04-04 15:07:11.838003
How to drink tea312,"In most cases, you’ll need to take some time in the morning to allow the water to cool down a bit, especially in hot weather. While tea is traditionally drunk in the morning, the right time for tea has recently passed. However, since this is an important part of traditional brewing, this is still a good time to prepare your tea and water.
The brewing technique requires only a small amount of water to brew, which is usually around 1 cup (2 ml) of water. However, to make your drink tea, use a small amount of water when you are ready to drink it and adjust accordingly.
After you’ve cooled your water, pour it over your drink or drink. This method involves taking a big pot of hot water and pouring a small bowl of water into a small cup (one to half a liter) of boiling water.  After you fill it up, take some of the hot water and slowly swirl it around on your drink until it’s completely boiling.
In order to stir the water around on your drink, you’ll need to gently tap the sides of your drink. Start by taking the water out of the pitcher with the lid on and pouring the hot water through a small mesh strainer. Then, bring the water out by putting the bowl of water into a small, metal container.",2022-04-04 15:07:54.324788
How to drink tea312,"It’s a basic green tea, and if you have a deep pot, it’s a good idea to try hot tea if you have problems with alkalinity or other issues. Try a full glass or mug, and stir until the tea is light and leaves are slightly brown. If you aren’t sure whether the leaves are edible, take a sip.

There are a few different kinds of tea: black tea (also called hot tea), sweet tea (also called smooth tea), and herbal tea. Choose sweet tea, with hints of cinnamon, lemon, milk, and some other spices.
If you don’t have much room in your kitchen, you can add cream if you prefer. Add a little salt if you don’t want the flavor of salt to become overwhelming.
Hot tea can be served in a small glass or mug, or in a large container. Place the glass or mug in the microwave and bring the tea to a boil. After an hour or so, remove the mug or glass from heat. Stir the tea occasionally for some extra flavor.

You can store hot tea in the refrigerator.
If you’re in a hurry, it’s best to let the tea sit in the refrigerator for about 10 to 15 minutes before you start preparing the tea.
You can make hot tea with just the water.",2022-04-04 15:07:56.080347
make bread,"There's no need to microwave a perfect loaf of bread. The best way to bake an artisanal bread is to slice and shape it into a loaf of bread that is perfectly smooth and fresh. However, any bread that’s less than perfect can be left out and thrown away.

Slice and shape a loaf of artisanal bread that’s perfectly smooth.
Take a single-cut artisanal loaf of bread and slice it between your index finger and thumb and press down on each side. Then, slice it between your thumb and ring finger, using a sharp pair of scissors to trim the ends with your fingers.
If you don’t have a pair of sharp scissors, you can use butter knives made for baking bread.
To ensure the bread’s crispiness, remove the bread from the pan, pan pan, and pan’s rim. Place your bread onto a cutting mat, and flip the bread over once it’s completely moist. To protect your hands, place your hands on a bread knife and pinch the handle to remove any stuck-on bits. This will ensure the bread is thoroughly moist and a light, crisp crust beneath the bread.
Slice each slice into pieces that fit neatly into your pan or bread.",2022-04-04 15:08:11.607042
How to drink tea312,"Tea is rich in caffeine, and contains many other strong and stimulating ingredients. 

You will want to take cold coffee and tea to make hot tea.
Take 2-3 cups. Cold brewed tea can cause the tea to taste bitter.
Lemon tea and milk tea are popular choices among tea drinkers, and these are particularly strong. You can drink plain liqueurs with lemon and lemon on the side, or try adding powdered lemongrass and pecan peels.
Sugar-free tea should be consumed in the morning.
Whole milk tea will only foam as it is steamed and cooled.
It is recommended to eat hot milk tea after it has been steamed, whether in the morning, at 4 o'clock, or in the afternoon. 
Lemon tea is often added to the tea.  It is strongly advocated for cold drinks, and some tea-adders say it is one of the best drinks to drink right after midnight. 

Fresh lemon tea will make you drowsy with your drink.
A lemon-flavored tea drink is excellent. A half-and-half can is one large serving of tea.

This could also be eaten as a snack.
There are tea-flavored drinks that are rich in caffeine and vitamins.",2022-04-04 15:08:12.400238
How to drink tea312,"Add some milk (any type of milk) to a cup of water and cover the bowl with a plastic mesh lid. Do not drink any tea in the bowl when you’re not in public.
You can either fill the bowl with water or pour the hot milk into a glass, large container, or bucket. A glass is usually better than a big bowl, however. Place the glass and container over a hot burner and let the milk heat up to 160 °F (43 °C). Continue heating the milk and letting it sit for about an hour.
You can try to keep the tea hot while you’re in the bathroom. It’s best to let it cool a bit if it’s too hot.
If you’re drinking tea for a family trip, don’t drink it. Allowing milk or tea to cool too hot can leave your face and mouth ice-cold. If you keep your mouth ice-cold after the tea tea, you might not drink the tea at all.
Set a tea tea plate behind the plate so the milk gets a good shake. Pour the hot milk into the plate slowly so the milk stays nice and smooth. This will keep the tea cool.
If your tea plate isn’t quite hot enough for you, just take the tea off the plate and stir gently.",2022-04-04 15:08:15.115676
How to drink tea312,"Some tea blends are made specifically to be enjoyed in conjunction with meditation, and are specifically marketed to people who tend to drink tea. Others are marketed for people with limited patience.  These are definitely not good tea blends for people who need to be relaxed and to pack a little more energy. However, these blends do provide some relaxation and a ton of energy to those who have difficulty with tea. These tea blends will definitely give you a boost of energy.
If you have limited time, or if you just don't have room to spare, consider adding a little bit of spice to your tea.
Most tea blends will have a subtle herbal twist, with hints of rose, nutmeg, and some mint in the background, to name a few. However, if you want to explore deeper into the tea, then you can use these tea blends to spice up your drink. Here are a few ideas:

Cinnamon tea has a subtle herbal twist, but it isn't quite as strong. Experiment with different combinations to see what works best for you.
Sweet tea is sweet and somewhat sweeter, but not quite as strong or as energizing as other sweet tea. Experiment with different tea blends to see what works best for you.

Peppermint tea is a very subtle and delicious tea blend, but it's not as strong as many tea blends.",2022-04-04 15:30:14.258618
make bread,"It is better to be thin and crumbly when making bread than to be thick and crumbly, so that the bread will be crunchy and tough to eat, but not crunchy when it's crunchy and tough. It's best to cook the bread before you put it in the refrigerator. If you can, you can eat the bread immediately after cooking to reduce the risk of crustiness.
If you don't have time to eat a slice of bread before the next trip or dinner, you can use a small bag of shredded cheese, cut the crust off with a knife and wrap it in aluminum foil.
If you’re making bread for kids or your family, the recipe is basically the same. You’ll start with the basic ingredients. Try to stuff 3-4 eggs, 2 tablespoons (30-45 grams) of salt, 2 tablespoons (30-45 grams) of fresh chopped fresh herbs, and 1 tablespoon (30 grams) of olive oil into an 8 by 8-inch (20- by 20-cm) loaf pan. Roll up the bread in aluminum foil, then microwave it until it’s crisp. You can also try to stuff 2 1/2 cups (3, 5 large eggs) of salad greens, 2 tablespoons (30 grams) of oil, and 1 cup (30 grams) of bread crumbs into the pan.",2022-04-04 15:30:42.797812
make bread,"for two or three weeks before you plan to bake. If you can't find bread in store, you can always check online for online bread boxes to see what bread you can find. You can use store-bought bread, or you can order online bread from a craft store.

Free-range eggs come in several varieties, so you'll need to check your local grocery store to find a variety. For example, if your local grocery store has egg boxes, order 2 eggs from the egg section of the grocery store. If they have more eggs, you can also check the general shape of the egg.
Free-range tilapia, French chard and other small, soft-boiled egg dishes will also be easier to find than breads that cost less than your local health food store. Here are some of the dish ideas to try:

French bread
Pickled radishes or mushrooms
Cheddar cheese
Butternut squash or ham
Toasted walnuts
If the dish idea is easy, but you don't have a whole lot of bread left, you can use some leftover white bread you used to make your delicious breakfast! Try to keep track of which items you bought in the bag and keep your ingredients separate from your bread. Make sure to check out the individual ingredients to see what they came with.",2022-04-04 15:30:43.643565
How to 312,"Your Celine%27s Fancy Pants
 To get your custom-made chic drawstring celine pants you'll need to make them custom-fitted for your cat and have them wrapped around your collarbone. You'll need:

Zipper or belt with zippers on it
Collar with zipper running down your neck
Shoe
Handle of the collar/teeth or other end of the celine
Glue or another heavy piece of fabric
Cat tailoring
To get your custom-fitted celine pants you'll need to have them cut and sewn in a single piece. Cut out the long pieces so they're all over the fabric. Then, cut each of the long pieces into five equal-sized pieces.

Cat tailoring requires 2"" by 4"" (150 cm × 200 cm) pieces for the top and bottom of the celine pants.",2022-04-04 15:31:15.474019
How to swim in a lake312,"If you can’t swim in the water, find another spot to paddle around without stepping on the water.  That’ll be where you want to stay, either while paddling or while the lake is moving around.

Be sure to choose a spot that's at least 6 by 8 feet (1.2 by 1.4 m), which is about the size of your head.
Be sure that you plan to move your body forward on the water, not backward, if you plan on swimming in the water.
To be clear, there will be no turning back when you come in the water. Instead, when you swim back in the water, everyone will either pass beneath you by stepping on your tailbone or simply sitting there.  This makes it extremely easy to slip back into your normal swimming form.
A good way to remember where you were when swimming in the water is in the middle of the lake, and to remember when you were just beginning.  Simply flip over and look at the direction you were swimming from to see how far you were from your starting position.

For example, in the shallow end of the lake, turn left on the right side.  On the left side, turn right on the left side.  In this case, you wouldn’t have been able to swim at least 3-4 feet (0.",2022-04-04 15:35:12.262624
How to swim in a lake312,"The best place to get your bearings is at a point close to the water, usually at about 10 feet (0.61 m) from the surface of the water. 

If you can find it, then be sure to stay at a depth of at least 25 feet (3.8 m) before turning around to give yourself a break from the water.
Take a short, straight path of about 20 feet (6.2 m) to the edge of the lake.  Turn the car into a 90-degree angle (as long as you are not moving your feet back and forth across the water) to face the opposite direction. 
You may need to keep your eyes open longer than 30 seconds to take a long, straight, straight swimming lane across the lake.
This is a short but effective way to get to the other end of a lake. It should not take you more than 30 seconds.
You may also want to approach the edge of the water and grab onto a railing or railing that can be used to anchor your body. 
You can make a safe, safe choice here, by turning your head to the right, then your head to the left to catch your breath, or by turning your head back to the right to keep your head straight. 
Your approach shouldn’t be drastic in how quickly you can change directions.",2022-04-04 15:37:32.264526
