How to test a model,"Measure the exterior of the car. The higher the number, the higher the rating will be on this scale.  The higher the rating, the higher the rating will be on the scale.  If the manufacturer has a model number, multiply it by 3 (3 + 5).
You can also find them on the manufacturer's website or by searching online for ""BMW 911.""
To give a sense of how powerful a car feels, set the car on a track in your neighborhood so you can be on it on a test drive. Get everyone in the area to sit in a circle, making sure there are no obstacles.
When you're done driving, stop for a minute to take a break.  Turn around and take a moment to test the front and rear of the car. If your car feels stiff at first, move on to the next section and give it some slack.
Once the test is complete, you can drive to your test space.  Take a moment to take your car to the front part of your local auto parts store.  Once you find the front wheel and the front bumper (belly), you can give the car another boost.

If your owners have a spare wheel, take the wheel to the back part of your garage to test.  Give it a boost if it gets in the way.",2022-04-03 17:17:49.099872
make bread,"To , slice the crust slightly. The longer you slice it, the thinner it will be. If you’re making a loaf, cut off the crust to expose a slice of crusty top. For a thicker, crustier loaf, use a cookie cutter.
If you don’t want to make the bread too thin, you can make your own crusty top with fewer pieces.
Divide your bread into equal pieces and put in the center of each slice. Start by taking a slice from the edge of the crust. Next slice the crust to the same side as the slice that you cut off before you cut off the last slice. Finally, take a piece that’s thinner than the last slice.
Try not to slice your slices too thinly, or they might just start to look misshapen. This could make them too long and thin, or they could just be too thin. For the crusty bread, you’re going to need to slice the crust to expose the top slices.
Keep in mind that your bread is only going to look crispier as you cut off the crust. Therefore, you’ll be cutting away the crust that you don’t want to expose.
Put 1 piece of crust down on the bottom of your slice. Then, put the next piece of crust in the middle of the bottom piece of crust.",2022-04-03 17:43:56.870937
make bread,"it is necessary that the cheese be whole. If you can, substitute ground flax for flaxseed.
You can choose to skip this step, or you can buy whole, whole, uncooked garlic and let it cool. If the garlic is whole, but not whole, cut it into cubes, and then slice it.
Place the cubes of whole garlic into a large bowl, or at the very top of the bowl, where you want to make the rest of the bread.
Slice the bread into 3-4 pieces (about 5-7 centimeters) long. The extra pieces will be your bread cubes, since you will not need to cut them out. You can use a sharp knife to cut the cubes into slices. Then place the bread cubes into the large bowl or plate and set them aside.
There is no dressing on the bread. A normal, dried slice, but not whole bread. You could also use a sharp chef's knife to cut the bread cubes.
While a normal, dried slice, or a whole loaf is good for this recipe, you could also eat it as a topping or toasted snack. The cheese, of course, would not be great on that, but it would be worth the time to consider.",2022-04-03 17:49:05.470927
make bread,"by hand. Place each slice into a large mixing bowl. Slowly pour warm water into the bowl, and stir until well mixed.
Carefully squeeze the bottom of each slice of bread together to ensure that they are coated with a protective coating.
This bread will need to be breaded before you can serve it. You can toast them with butter if you'd like them, or you can toast them with olive oil if you'd rather spread the oil over the slices.
If you'd like your bread to be soft or crumbley, try to slice it first so that it's soft enough to handle.
Take a slice of each bread cut into strips. Grate them together and transfer them to the bowl. Heat the oil in the skillet on medium-high until the oil dissolves and the bread forms a thin puffy ball.
Keep an eye on your bread as it matures, and check and adjust the temperature to see if it's risen. If it's not, remove the slices. If it's still hot, leave it for an hour.
When you're ready to serve the bread with butter, turn the pan over so that you can easily wipe away any excess oil. Set each loaf of bread in the bowl so that they're wrapped in a clean, damp dish.",2022-04-03 17:52:38.031274
make bread,"If you can't find bread at your local grocery store or a craft store, take it from the bread section of your local kitchen.

If your dish has a French presser board, try removing the french presser board to the pan to loosen the bread.
Use a butter knife and scoop the bread out of the pan with a soft, butter knife.
Pour in 1 ⁄2 cups (350 mL) of warm water.  Bring a splash of the water to a boil, cover the pan with ice, and reduce it to a simmer.
The water must be hot enough to completely submerge the pan.
The water can come in a spray bottle or foam pack made from craft and regular dish soap.
Once the water is reduced to a simmer, remove the pan from the heat and place the pan in the fridge.
Place 1 ⁄2 cups (350 mL) of water in a microwave-safe bowl.  Heat the water until it is hot enough to melt the soap fragments.  Allow the water to sit for 10 minutes, until melted.  Depending on the thickness of the soap fragments, it may take 10 minutes to melt the rest of them.

You can add or omit the pieces if you prefer.
Place the pan in the microwave and allow the water to boil for 10 minutes.",2022-04-03 17:52:53.428392
make bread,"To , combine 1/4 cup warm water, 4 tbsp (15 g) vinegar, 1 tsp (1 ml) garlic powder and 1 tsp (3.8 ml) whole ginger into a medium mixing bowl. Mix these ingredients in with your mixer before mixing the rest of the ingredients together. Then, add the cooled water, stir, then add the ginger. Continue mixing and adding until the mixture is smooth.

If your recipe calls for making bread crumbs instead of raisins, you can add 1/4 cup (25 g) sugar and 1/2 cup (120 ml) cold water.
Use an electric mixer to mix the ingredients, then add 1 tsp (1 ml) all-purpose flour as well. Turn the mixer on to medium-high speed.
Then, pour the flour into a bowl. Use your fingertips to work in a circular motion to combine the ingredients. Keep mixing the ingredients until they are a thick, uniform paste.
When all the ingredients are combined, stir the mixture and mix it into the prepared dough.
While most doughs can be made with a wide variety of dough types, some brands will make you grow bread that will vary in size.
When you are ready to let the dough rise, roll a large baking sheet over it. Fold a piece of parchment paper over the sheet to make sure it's evenly covered.",2022-04-03 17:58:45.506507
make bread,"by slicing the pieces in half first so the pieces are cut down at a 45 degree angle.
Place slices in front of you so they're in a single layer.
Set the pieces aside while you take them out.
The slices should be in a single layer on each of your tablecloths.
Lay your bread flat on the tablecloth and lay the top layer across the tablecloth, then flip the paper underneath to reveal the top layer.
Use your thumbs to gently peel away the paper and the top layer of the paper as you go, until the inside is completely covered with layers of bread.
Once you're finished with the bread, flip the paper and top layer to reveal the sides.
Put a hand across your face and keep your fingers on the bread as you lay it down. Don't worry about wrapping the bread up, as this will give your cuticle more protection.
After you're done, you can turn the paper over so the side pieces fit neatly together, and serve it.",2022-04-03 18:01:49.602567
make bread,"Preheat the oven to 350 degrees F (177°C). Set your oven rack on the lowest rack you can comfortably place it on. Then, use your hands to roll a dough hook and hook it into the loaf of bread. Start rolling it down the seam. Roll it until it's about 45 centimetres (0.25 in) from the inside, about 6-10 centimetres (1.3 in) from the outside.
Roll the dough back and forth in a circular motion, making sure they're even. Keep rolling the dough into long strips about 6 to 8 centimetres (1.3 in) from each other.
To make extra crispy bread, just roll the dough balls a third time so it's mostly crispy.
Toasted, sesame, and dried fruit are all good options, as are plain yogurt and honey.
Once the bread is ready, it's time to slice it. Begin by making five consecutive rounds of four-sided breadcrumbs at a time. Then, place the slices on a cutting board that's about 16-18 centimetres (30-38 in) across. Then, place your loaf on a cutting board and slice that way. Continue to slice each round about 1 centimetre (0.25 in) until the bread is completely cut.",2022-04-03 18:05:08.533664
How to draw pineapples,"One of the most common ways that people see and smell pineapples is through a straw. When peeling off the outer casing, you will want to choose a straw with a strong smell, which is how you would remove the fibers and skins of pineapples. This type of straw will also work well for other mossy, waterlogged plants. For instance, pineapples are known to drink lukewarm water and froth. Alternatively, you could soak pineapples in plain tap water and mix it up with a few lukewarm tap water and cold water and see if it turns off the scent of the water.
Pineapples prefer bright colors, so try to find bright, mossy pineapples where the shade is somewhere that blends in with the sun, and the soil there is good (pink or yellow limestone). In any outdoor location, try to find bright, mossy or otherwise slightly acidic areas that blend in with the sun.
If you are trying to remove the scent of the mossy sand, add a small amount of mild laundry detergent to the mix (such as Dawn or Dawn Plus) so that it blends in more closely with the rest of the plant.
Wear gloves, wash hands thoroughly, and keep out of direct sunlight as pineapples grow.",2022-04-03 18:05:46.614101
make bread,"The basic recipe will consist of:

5 tbsp. salt
¼ cup sugar
1½ tbsp. baking powder
1½ tbsp. cocoa powder
1½ tbsp. red wine vinegar
¼ tsp. fresh dill pickles
To prepare the yeast, prepare the water. Add 2 cups of water, a cup of sugar, 1 cup of flour, 8 cloves of minced garlic, 1 cup of vinegar, 2 cups of warm water, 1/2 cup sugar, 2 tsp. cinnamon, and ½ tsp. to a ¼ cup of water. Stir well, then allow to sit for 5 minutes, then remove the dough from the warm water.
Knead the dough for another 5 minutes, then smooth it out with a rolling pin.
You can use whatever texture you prefer, but it's a good idea to work with a thicker dough than your hands.

Place the dough in a bowl, then turn on your stand mixer, add 1 tablespoon (15 g) butter, and beat on medium speed for 2 minutes.

It is a good idea to use a light-colored dough for this recipe.
If you are making a quick spread, it is fine to use more butter.
The yeast should come to a rolling boil when it's ready to be mixed. Let stand for 10 minutes, then remove the dough from the heat.",2022-04-03 18:06:21.490898
How to draw pineapples,"Draw pineapples in straight lines to be more camouflaged, and to emphasize the shade of the leaves (if you have them) of the pineapples.

You can use your finger as a compass as you draw your pineapples.
You can also fill in the details of the drawing or by filling in the details that you'd like to make.
Color them to match your favorite color, then add details as you go. You can fill in a variety of different shades of blue, yellow, green, pink, orange, brown, or even red.
Don't use gray or white as your guideline when drawing pineapples. Use an eye color that closely matches the shade of the tree.
For the most classic of the pineapples, draw a vertical line to connect the lines of the tree with the back-leaf of the fruit.
Draw a tiny line of leaves that are almost touching the stem (about 2.5 inches) going up from the bottom of the tree. To be more distinct, add a few branches, one after another, that connect the leaves together, and then add leaves that are about the same size.
Try to use these lines without leaving too much of a stretch or streak, because these lines will easily bleed to create a final look.",2022-04-03 18:06:24.598504
How to draw pineapples,"If you want to start the pineapple art, go to a local nursery and pick out the colorful fruit. If you’re growing a pineapple plant, you’ll need to buy the whole thing from your local nursery.
Pineapple trees are often confused with bush trees. When compared to bush trees, bush trees are bushier than pineapples.
Using the proportions of the two to represent bushiness, draw a circle in the middle of the circle. Then, draw two small circles in the middle that are at least 3 inches (7.6 cm) wide. Next, draw the two vertical lines along the horizontal lines, drawing lines straight down towards the middle. Finally, color them to match the color of your pineapple.

For example, if you want your tree to have red-orange accents and green-brown accents, add a deep purple.
If you want your tree to have red coloring, color it red-pink-pink and vice versa.
If you’d like to color the pineapple, choose another color. For example, if you’d like to have purple accents, add a light purple for the purple part.
Start with the leaves and branch, and move them down into the center, using a small piece of string as a guideline. Continue until you reach the leaf.",2022-04-03 18:07:16.159730
make bread,"it into rolls once you've made it.
While it may be easier to just use the rolled-up bread from your favorite store, it's not always possible. Make sure to eat your rolls first. Once they're soft and they’re wrapped in foil, you can eat them to enjoy them.
Preheat the oven to 350 °F (232 °C). You can use the same steps as above, but make sure you use grease and not dry food.  Place the rolls in a greased plastic bag.
If you don’t have a plastic bag, simply peel away the foil and eat them.
Place the roll-up onto a baking sheet and place it into the oven for about 10-15 minutes to get the roll-up fully coated. Make sure it’s completely coated so there’s room to escape from the foil.
After 10-15 minutes, remove the foil from the oven. You may have to remove it to do this.
If you'd like your rolls to be crispier, you can toast them for an hour. Just wait until they’re done.
Put the wrapped rolls into the oven and let them bake at 350 °F (232 °C). You can then bake them again.",2022-04-03 18:10:42.518839
How to draw pineapples,"This will be the framework for the top part of your drawing. Make sure to align the outline lightly so that your pineapples have a level face and can be viewed from above.  If the outline is too round, you can add details in the proportions, such as claws or fur.

If the outline is too dark, you can make the tree in the bottom draw a simpler and more unique shape.
You will need a piece of cardboard or paper to draw the bottom part of the drawing.
The bottom layer should be thick enough to allow you to fill in the details. Add a darker layer to the background.
This will be the framework for your pineapples.
Draw a horizontal line from the lower right of your drawing to the top left of the center of the drawing.
Using only two thin lines, draw a rough outline of the tree with a sharp angle.
Draw the bottom layer over the middle layer.
Draw a line from the left of the left of the right of the right to the right of the left of the center, overlapping the first two layers.
Draw a line from the top of the top of the top layer to the right of the center.
Note that the two layers will need to be very close together, so that you can make the tree appear thicker.",2022-04-03 18:11:23.459772
How to draw pineapples,"The shape of your pea pine tree is a little different than most other types of pine.
Draw 2 ovals to give your pea pine a round shape. Use a compass to make 3 ovals across the upper section of the ovals, and 2 more ovals inside the lower section of the ovals. Draw two ovals to define the front section of the pea pine.
For example, draw the front of the pine stem.
Draw the outline of the pine tree behind it.
Add as many ovals as you want to make the tree. Use more ovals to add depth as you create the tree.

Use different colored pencils depending on what type of pine you want to create. Some pineapples will have light yellow veins. You may use lighter red veins, some pineapples will have yellow veins and some pineapples will have orange veins. You will add ovals to the trees as needed until you reach your desired depth.
To draw the pineapples, make as much outline of the tree as you want the pineapples to have.

Using a ruler, draw a straight line that extends from the base of the tree. Make the line about 2 to 5 feet (0.91 to 0.91 m) long.
Draw the outline of the tree behind the first parallel line you made earlier.",2022-04-03 18:12:26.836036
How to draw pineapples,"Draw the outline of your plant by drawing 2 thick lines.
Darken the outline with darker strokes.
Erase unnecessary strokes.
Color in the drawing.
The color should be around the middle of the circle.
You can use multiple colors, as long as you choose a one that blends well.
The shade can be either orange, green, yellow, purple, or anything else you want it to be. If you want it to match your favorite plant, you can go for ""peatott.""
Pineapples are big, spindly plants that get what they need from their environment. To add pineapples to your garden, build a large pottery structure that is 3 feet (0.91 m) tall and 18 feet (30 cm) deep. The structure will be 12 by 12 feet, but you could also build a terrace, depending on your plant's size. It will be made of cedar, spruce, firs, and other type of wood.
The top of the peaty structure is a 4 by 4 inch (10 by 15 cm) space that fills up a large peaty pot. The bottom is a 4 by 6 inch (10 by 15 cm) area that is filled to the height of 1 foot (0.",2022-04-03 18:13:48.137027
make bread,"If you are making panko or pizza, place your loaf of bread in your refrigerator and put it in the fridge for approximately 45 minutes. You can also try to eat the bread in a breadbox if you are in the area and check on the progress of your panko maker before you eat it.
Panko bread is often eaten warm so it isn’t as dense as other type of bread. In addition to making panko bread, you can make other types of bread like pastries, muffins, and tacos.
If you don’t like panko bread, skip this step.
You can cook panko bread at home, either in the oven or on the stove. It can be used for cooking up veggies like basil, cauliflower, or onions.
You can also try a panko pita by substituting a tomato for the egg and placing your pita in the middle. Place the pita in a small bowl and place the bowl in the fridge for 15 minutes. You can let the pita rest for 20 minutes.
Panko bread is sometimes sold as a snack after it’s been in the fridge for at least 3 days. However, if you want to make panko pita inside out, you can also use whole wheat panko instead of whole wheat.",2022-04-03 18:14:52.751724
How to draw pineapples,"Before you begin preparing your pineapples, you’re going to want to decide what kind of fruit you want to grow. Consider two kinds of fruit that are ready- ripe: ripe peach and fresh peach.

Prych off 1/2 of the fruit in order to make apple pie and cut it into 2-inch pieces.
Pick a ripe apple for this recipe: ripe fresh apple.
Use a serrated knife to cut the fruit into 4-inch pieces.
Use a clean knife to cut the peach into 3-inch pieces.
You can also make a pineapple or cherry pineapple for this recipe.
Place the sliced fruit on a cooling rack. The pineapple will absorb a little cold water. Add some lemon juice and use it to sweeten the pineapple. The pineapple should absorb this cool water.
Pour the remaining water into a glass bowl. Shake the glass often.
If the fruit is too cold to handle, it's best to simply leave the pineapple whole. Use only citrus slices if you're worried you'll bruise the pineapple.
Stir them until they’re a slightly translucent liquid.
Use a rubber spatula or kitchen fork to stir the pineapple into the water. The pineapple will take 30 to 60 minutes to fully absorb the water.
Pour in the remaining water. Wait for the pineapple to cool to room temperature.",2022-04-03 18:14:56.346213
how to make a good presentation,"This can include drawing and sound effects, music, and graphics. Practice taking notes before you practice, and after you've thought about each step.

Even if you practice and improve on all of these, they shouldn't be so difficult that they require no improvement.
Practice in the background using the same techniques you used when you first learned to make sounds. Once you master the basics, you'll have great control over what you do with your presentation, which is a great thing to do when you want to make a good presentation.
You can also use these techniques as a way to keep your audience engaged with the sound.
You can use the same techniques you used to make the musicals as well as the graphics, which you can incorporate into your presentation.
You can practice your presentation on the stage, in the audience, or on a digital screen if you want to.
Many of the techniques that you use to make graphics are simple, such as taking a picture in the background and coloring the background with shades of different shades of different colors. They can be combined in your presentation, which can save time and focus on the features that you don't use.
If you like, you can combine your presentation with one large presentation and have a small one, like a picture of a beach in your background, for a smaller presentation.",2022-04-03 18:36:05.982800
How to ,"Do Different Swimming Freestyle
 Stand sideways, and hold 1 leg at a 45-degree angle to your body with 1 leg in front of you, kicking slowly at the waist.

This is also called turning the torso to one side.
Hold the other leg at a 45-degree angle.
The goal is to hold your legs as straight as you can, then slowly lift yourself up.
Do this slowly until you can no longer maintain your balance.
This may feel counterintuitive, but you should be able to maintain your position.
Remember to lift your legs slowly, but as you exhale, slowly raise your torso back to 90 degrees. This will help keep you balanced and help you keep your balance.
In other words, do this at least 5 times.
Stand straight, and keep your right leg straight.
Slowly bring your right leg back into a squat position.
Now, switch legs so the left leg is standing on the opposite side.
Keeping your knees straight, lift one leg as you lift the left leg.
This will keep you balanced, but you will lose weight.
Keep your hips still as you lift the left leg.
If your knees feel tense, turn them over and lift the other leg with your hands.
Repeat until you have the right leg.
Repeat this until you can no longer maintain your balance.",2022-04-03 18:36:06.250654
how to make a good presentation,"When you’re performing a presentation like this, make sure that there’s an open space between the photos and video that the audience can easily pass on to them.",2022-04-03 18:36:48.109163
how to make a great presentation,"by having an audience.
 audience is what matters most in storytelling, and they are the ones watching to see what you did. This can mean a lot.",2022-04-03 18:37:11.218114
how to make a great presentation,"The speakers in this presentation will use the best materials to focus on what you want to happen.

You'll need:

A solid black, satin, or silver screen or plate to reflect the person or information that you want to talk about.
A digital camera or screen with a lens that can record audio.",2022-04-03 18:37:33.406300
how to make a great presentation,"Making a presentation is a process that will take lots of practice.

It should take practice sessions, lots of hours of exercise and lots of patience.
Make sure you have an understanding of how this works and how to make it work. 

Begin by explaining your ideas, the format, the guidelines, and the audience that will come to your presentation.",2022-04-03 18:37:42.978965
How to ,"Do a quick test. Go on to your phone or read the instructions on your device.  Then, hold the button for 30 seconds or so.  Then,  press or hold for another 30 seconds.  Then,  release the light.
This process is known as repeated test. The second test will confirm your results. After each successive pass, repeat the test.  Do not press or hold the button again.
The timing on your test might seem odd, but your smartphone's clock will beep whenever you perform a specific task.  That way, when you are finished, the time is just right.

Always record a video so you can send it along with you when your test is complete.
Record your tests on your home computer.  That way, you won’t have to memorize them later.  Some people also record video on an external camcorder.
Ask your doctor.  Do these tests while you are out and about.  After a certain amount of time, this will become your normal practice.
Ask your doctor if he or she has seen you before.  If you aren’t certain, check with your doctor before you perform any tests.  Sometimes, the results will seem random, but a doctor may have an easier time predicting what your results will be like.

You may need to take longer to perform tests.",2022-04-03 18:40:04.262059
